{
  "schemaVersion": 1,
  "generatedBy": "bun run ui:census:generate",
  "firstPartyScope": [
    "core",
    "official-bits"
  ],
  "repositories": {
    "bakin": {
      "ref": "3dd584fa9f90f1c1fbf7843d702ecaf701693518"
    },
    "bakin-bits-official": {
      "ref": "ced0bb6577d97c60568cb138e33bf2bae69b22d6"
    }
  },
  "sdk": {
    "workspaceVersion": "0.0.0-workspace",
    "officialBitsFixtureVersion": "0.1.1-rc.1"
  },
  "plugins": {
    "_template": {
      "repository": "bakin-bits-official",
      "role": "author-template",
      "version": "0.0.0",
      "bakinRange": ">=0.0.1-rc.1",
      "routes": {
        "total": 1,
        "visual": 1,
        "aliases": []
      },
      "slots": [
        "home-widget"
      ]
    },
    "messaging": {
      "repository": "bakin-bits-official",
      "role": "official-plugin",
      "version": "0.12.2",
      "bakinRange": ">=0.0.1-rc.42",
      "routes": {
        "total": 5,
        "visual": 4,
        "aliases": [
          "/messaging"
        ]
      },
      "slots": [
        "nav-badge-providers"
      ]
    },
    "projects": {
      "repository": "bakin-bits-official",
      "role": "official-plugin",
      "version": "0.11.4",
      "bakinRange": ">=0.0.1-rc.41",
      "routes": {
        "total": 4,
        "visual": 3,
        "aliases": [
          "/projects/new"
        ]
      },
      "slots": [
        "nav-badge-providers"
      ]
    },
    "terminal": {
      "repository": "bakin-bits-official",
      "role": "official-plugin",
      "version": "0.3.4",
      "bakinRange": ">=0.0.1-rc.42",
      "routes": {
        "total": 2,
        "visual": 2,
        "aliases": []
      },
      "slots": []
    }
  }
}
